<?xml version="1.0"?>
	<!DOCTYPE Student SYSTEM "Q8.dtd">
		<Student>
			<rollno>1</rollno>
			<name>vdfad</name>
			<marks>
				<webtec>er</webtec>
				<xml>eff</xml>
				<j2ee>fef</j2ee>
				<ns>ef</ns>
			</marks>
			<rank>fdf</rank>
		</Student>